quantity,item_value,description,ocid
5.0,1961.57,SERVICIOS DE ALBAÑILERIA,ocds-5wno2w-LICO-GADMCH0001-2022-43412
150.42,15.06,ARENAS DE MAR,ocds-5wno2w-LICO-GADMCH0001-2022-43412
8724.36,0.22,TRANSPORTE DE MATERIALES ARIDOS,ocds-5wno2w-LICO-GADMCH0001-2022-43412
1460.69,4.84,RELLENOS,ocds-5wno2w-LICO-GADMCH0001-2022-43412
211.39,4.35,MOVIMIENTOS DE TIERRAS,ocds-5wno2w-LICO-GADMCH0001-2022-43412
10.0,794.17,"LUMINARIAS INCANDESCENTES, UNIDADES DE REFLECTOR, LAMPARAS FLUORESCENTES, UNIDADES CON REFLECTOR SE ",ocds-5wno2w-LICO-GADMCH0001-2022-43412
2300.0,4.96,"CABLE FLEXIBLE DE COBRE DE USO GENERAL PARA UN VOLTAJE DE HASTA 600 V, CALIBRE 4 AWG",ocds-5wno2w-LICO-GADMCH0001-2022-43412
156.0,76.19,"LUMINARIAS INCANDESCENTES, UNIDADES DE REFLECTOR, LAMPARAS FLUORESCENTES, UNIDADES CON REFLECTOR SE ",ocds-5wno2w-LICO-GADMCH0001-2022-43412
1075.0,63.73,SEPARADORES DE VIAS,ocds-5wno2w-LICO-GADMCH0001-2022-43412
380.0,35.4,SEPARADORES DE VIAS,ocds-5wno2w-LICO-GADMCH0001-2022-43412
80.0,83.03,BOLARDOS,ocds-5wno2w-LICO-GADMCH0001-2022-43412
8204.1,7.62,DEMARCACION DE CALZADAS,ocds-5wno2w-LICO-GADMCH0001-2022-43412
20713.6,1.37,DEMARCACION DE CALZADAS,ocds-5wno2w-LICO-GADMCH0001-2022-43412
54.0,31.47,DEMARCACION DE CALZADAS,ocds-5wno2w-LICO-GADMCH0001-2022-43412
8.0,591.65,DEMARCACION DE CALZADAS,ocds-5wno2w-LICO-GADMCH0001-2022-43412
1.0,630.19,DEMARCACION DE CALZADAS,ocds-5wno2w-LICO-GADMCH0001-2022-43412
50.0,128.98,SERVICIOS DE ALBAÑILERIA,ocds-5wno2w-LICO-GADMCH0001-2022-43412
30.0,19.67,LIMPIEZA DE SEDIMENTOS,ocds-5wno2w-LICO-GADMCH0001-2022-43412
200.0,4.43,SUMINISTRO DE AGUA EN TANQUEROS,ocds-5wno2w-LICO-GADMCH0001-2022-43412
1.0,1534.0,"CONFECCION DE VALLAS PUBLICITARIAS, INCLUYE ROTULOS, VALLAS, GIGANTOGRAFIAS, ETC",ocds-5wno2w-LICO-GADMCH0001-2022-43412
10.0,148.85,ROLLO DE MALLA PARA CERRAMIENTO,ocds-5wno2w-LICO-GADMCH0001-2022-43412
3000.0,0.15,CINTA DE SEGURIDAD,ocds-5wno2w-LICO-GADMCH0001-2022-43412
20.0,71.27,PRENDAS DE VESTIR PARA SEGURIDAD INDUSTRIAL,ocds-5wno2w-LICO-GADMCH0001-2022-43412
6348.92,0.53,TRANSPORTE DE MATERIALES ARIDOS,ocds-5wno2w-LICO-GADMCH0001-2022-43412
25538.0,0.78,TOPOGRAFICOS Y SIMILARES,ocds-5wno2w-LICO-GADMCPE-01-2022-19326
9227.0,0.69,SERVICIOS DE DESBROCE DE VEGETACION PARA ZONAS ABIERTAS,ocds-5wno2w-LICO-GADMCPE-01-2022-19326
109.0,7.0,SERVICIOS DE DERRIBO Y DEMOLICION  DE EDIFICIOS Y OTRAS ESTRUCTURAS ,ocds-5wno2w-LICO-GADMCPE-01-2022-19326
4.0,681.13,POSTE CIRCULAR DE HORMIGON ARMADO DE 12  M X 400 KG.,ocds-5wno2w-LICO-GADMCPE-01-2022-19326
780.0,17.94,RELLENOS,ocds-5wno2w-LICO-GADMCPE-01-2022-19326
5197.0,4.28,SERVICIOS QUE REQUIEREN LA CONSTRUCCION DE ENCOFRADOS Y DE REFUERZOS,ocds-5wno2w-LICO-GADMCPE-01-2022-19326
5197.0,24.97,"SERVICIOS QUE UTILIZAN EN GENERAL HORMIGON (CIMIENTOS GENERALES, HILADAS DE BASE, CIMENTACION SOBRE LOSAS, PUNTALES, PAVIMENTOS, ETC.)",ocds-5wno2w-LICO-GADMCPE-01-2022-19326
2307.0,17.62,MOVIMIENTOS DE TIERRAS,ocds-5wno2w-LICO-GADMCPE-01-2022-19326
11534.0,12.75,"SERVICIOS QUE UTILIZAN EN GENERAL HORMIGON (CIMIENTOS GENERALES, HILADAS DE BASE, CIMENTACION SOBRE LOSAS, PUNTALES, PAVIMENTOS, ETC.)",ocds-5wno2w-LICO-GADMCPE-01-2022-19326
11534.0,9.69,"MALLA ELECTROSOLDADA PARA REFUERZO DE HORMIGON D=5,5; 6250X2400; 150X150 MM",ocds-5wno2w-LICO-GADMCPE-01-2022-19326
4720.0,6.07,SERVICIOS DE ALBAÑILERIA,ocds-5wno2w-LICO-GADMCPE-01-2022-19326
9328.0,3.24,EXCAVACIONES,ocds-5wno2w-LICO-GADMCPE-01-2022-19326
693.0,10.91,EXCAVACIONES,ocds-5wno2w-LICO-GADMCPE-01-2022-19326
10019.0,2.91,"MANEJO, LIMPIEZA DE LODOS",ocds-5wno2w-LICO-GADMCPE-01-2022-19326
17792.0,0.76,EXCAVACIONES,ocds-5wno2w-LICO-GADMCPE-01-2022-19326
17792.0,0.87,"CONSTRUCCION, RECONSTRUCCION Y MANTENIMIENTO DE CARRETERAS",ocds-5wno2w-LICO-GADMCPE-01-2022-19326
1557.0,5.82,RELLENOS,ocds-5wno2w-LICO-GADMCPE-01-2022-19326
3588.0,21.18,RELLENOS,ocds-5wno2w-LICO-GADMCPE-01-2022-19326
754.0,23.03,RELLENOS,ocds-5wno2w-LICO-GADMCPE-01-2022-19326
2079.0,36.23,"SERVICIOS QUE UTILIZAN EN GENERAL HORMIGON (CIMIENTOS GENERALES, HILADAS DE BASE, CIMENTACION SOBRE LOSAS, PUNTALES, PAVIMENTOS, ETC.)",ocds-5wno2w-LICO-GADMCPE-01-2022-19326
378.0,15.23,ARENAS DE RIO,ocds-5wno2w-LICO-GADMCPE-01-2022-19326
12769.0,23.76,OTRAS OBRAS DE INGENIERIA CIVIL,ocds-5wno2w-LICO-GADMCPE-01-2022-19326
5023.0,1.64,"SERVICIO DE MANTENIMINETO DE CARRETERAS REPOSICION DE CARPETA ASFALTICA, PAVIMENTO",ocds-5wno2w-LICO-GADMCPE-01-2022-19326
5023.0,18.95,ASFALTADO DE VIAS,ocds-5wno2w-LICO-GADMCPE-01-2022-19326
143.0,178.79,"SERVICIOS QUE UTILIZAN EN GENERAL HORMIGON (CIMIENTOS GENERALES, HILADAS DE BASE, CIMENTACION SOBRE LOSAS, PUNTALES, PAVIMENTOS, ETC.)",ocds-5wno2w-LICO-GADMCPE-01-2022-19326
40.0,136.82,PLANTAS,ocds-5wno2w-LICO-GADMCPE-01-2022-19326
2254.0,3.61,EXCAVACIONES,ocds-5wno2w-LICO-GADMCPE-01-2022-19326
562.0,54.97,TUBOS DE PVC,ocds-5wno2w-LICO-GADMCPE-01-2022-19326
990.0,42.08,TUBOS DE PVC,ocds-5wno2w-LICO-GADMCPE-01-2022-19326
518.0,25.0,TUBOS DE PVC,ocds-5wno2w-LICO-GADMCPE-01-2022-19326
224.0,19.05,ARENAS DE RIO,ocds-5wno2w-LICO-GADMCPE-01-2022-19326
27.0,801.49,"SERVICIOS QUE UTILIZAN EN GENERAL HORMIGON (CIMIENTOS GENERALES, HILADAS DE BASE, CIMENTACION SOBRE LOSAS, PUNTALES, PAVIMENTOS, ETC.)",ocds-5wno2w-LICO-GADMCPE-01-2022-19326
88.0,105.33," SERVICIOS DE INSTALACION DE PRODUCTOS METALICOS ELABORADOS, EXCEPTO MAQUINARIA Y EQUIPO",ocds-5wno2w-LICO-GADMCPE-01-2022-19326
2.0,79.98,TUBOS DE PVC,ocds-5wno2w-LICO-GADMCPE-01-2022-19326
2.0,126.75,TUBOS DE PVC,ocds-5wno2w-LICO-GADMCPE-01-2022-19326
23.0,801.49,"SERVICIOS QUE UTILIZAN EN GENERAL HORMIGON (CIMIENTOS GENERALES, HILADAS DE BASE, CIMENTACION SOBRE LOSAS, PUNTALES, PAVIMENTOS, ETC.)",ocds-5wno2w-LICO-GADMCPE-01-2022-19326
803.0,3.61,EXCAVACIONES,ocds-5wno2w-LICO-GADMCPE-01-2022-19326
1672.0,19.66,TUBOS DE PVC,ocds-5wno2w-LICO-GADMCPE-01-2022-19326
160.0,19.05,ARENAS DE RIO,ocds-5wno2w-LICO-GADMCPE-01-2022-19326
86.0,285.82,HORMIGON PREMEZCLADO,ocds-5wno2w-LICO-GADMCPE-01-2022-19326
459.0,25.0,TUBOS DE PVC,ocds-5wno2w-LICO-GADMCPE-01-2022-19326
50.0,102.6,CONSTRUCCION DE REDES URBANAS DE ALCANTARILLADO,ocds-5wno2w-LICO-GADMCPE-01-2022-19326
150.0,25.48,SERVICIOS GENERALES DE REPARACION Y MANTENIMIENTO,ocds-5wno2w-LICO-GADMCPE-01-2022-19326
180.0,169.18,AGUA POTABLE,ocds-5wno2w-LICO-GADMCPE-01-2022-19326
2680.0,3.61,EXCAVACIONES,ocds-5wno2w-LICO-GADMCPE-01-2022-19326
2161.0,7.21,TUBOS DE PVC,ocds-5wno2w-LICO-GADMCPE-01-2022-19326
20.0,5.11,TUBOS DE PVC,ocds-5wno2w-LICO-GADMCPE-01-2022-19326
2.0,5813.29,ACCESORIOS PARA TUBERIA,ocds-5wno2w-LICO-GADMCPE-01-2022-19326
2.0,11.47,TUBOS DE PVC,ocds-5wno2w-LICO-GADMCPE-01-2022-19326
507.0,3.24,EXCAVACIONES,ocds-5wno2w-LICO-GADMCPE-01-2022-19326
507.0,2.91,"MANEJO, LIMPIEZA DE LODOS",ocds-5wno2w-LICO-GADMCPE-01-2022-19326
102.0,17.94,RELLENOS,ocds-5wno2w-LICO-GADMCPE-01-2022-19326
85.0,17.62,MOVIMIENTOS DE TIERRAS,ocds-5wno2w-LICO-GADMCPE-01-2022-19326
34.0,154.97,"SERVICIOS QUE UTILIZAN EN GENERAL HORMIGON (CIMIENTOS GENERALES, HILADAS DE BASE, CIMENTACION SOBRE LOSAS, PUNTALES, PAVIMENTOS, ETC.)",ocds-5wno2w-LICO-GADMCPE-01-2022-19326
282.0,237.76,"SERVICIOS QUE UTILIZAN EN GENERAL HORMIGON (CIMIENTOS GENERALES, HILADAS DE BASE, CIMENTACION SOBRE LOSAS, PUNTALES, PAVIMENTOS, ETC.)",ocds-5wno2w-LICO-GADMCPE-01-2022-19326
701.0,10.15,SERVICIOS QUE REQUIEREN LA CONSTRUCCION DE ENCOFRADOS Y DE REFUERZOS,ocds-5wno2w-LICO-GADMCPE-01-2022-19326
24400.0,2.22,VARILLAS DE HIERRO PARA LA CONSTRUCCION,ocds-5wno2w-LICO-GADMCPE-01-2022-19326
130.0,13.33,JUNTAS DE EXPANSION PARA CONSTRUCCION ,ocds-5wno2w-LICO-GADMCPE-01-2022-19326
1545.0,28.32,DEMARCACION DE CALZADAS,ocds-5wno2w-LICO-GADMCPE-01-2022-19326
2599.0,0.7,PINTURA PARA DEMARCACIóN VIAL BASE SOLVENTE COLOR BLANCO TIPO DE RESINA ACRILICO,ocds-5wno2w-LICO-GADMCPE-01-2022-19326
40.0,234.42,PARTES YI PIEZAS DE ROTULOS DE SENALIZACION INDUSTRIAL,ocds-5wno2w-LICO-GADMCPE-01-2022-19326
40.0,240.52,PARTES YI PIEZAS DE ROTULOS DE SENALIZACION INDUSTRIAL,ocds-5wno2w-LICO-GADMCPE-01-2022-19326
100.0,0.54,CINTA DE DEMARCACION,ocds-5wno2w-LICO-GADMCPE-01-2022-19326
18.0,135.17,SERVICIOS DE INSTALACION PARA TODOS LOS TIPOS DE OBRAS DE CALLE (POR EJEMPLO VALLAS PROVISIONALES),ocds-5wno2w-LICO-GADMCPE-01-2022-19326
2.0,681.36,PARTES YI PIEZAS DE ROTULOS DE SENALIZACION INDUSTRIAL,ocds-5wno2w-LICO-GADMCPE-01-2022-19326
400.0,3.16,SUMINISTRO DE AGUA EN TANQUEROS,ocds-5wno2w-LICO-GADMCPE-01-2022-19326
1.0,51972.23,SEGURO MULTIRIESGO,ocds-5wno2w-LSG-DD09D04-002-2022-161795
1.0,76685.94,READECAUCION DE EDIFICACIONES ESCOLARES,ocds-5wno2w-MC0-09D24-2022-003-461337
1.0,7740.01,SEGUROS POR CHOQUE,ocds-5wno2w-LICS-INNEP-001-2022-591024
1.0,196362.86,READECAUCION DE EDIFICACIONES ESCOLARES,ocds-5wno2w-MCO-06D01-002-2022-533868
1.0,80301.54,SERVICIOS DE ALBAÑILERIA,ocds-5wno2w-MCO-09D24-2022-002-461337
1.0,17273.49,SERVICIOS DE ALBAÑILERIA,ocds-5wno2w-MCOB-01D02-001-2022-533253
1.0,119435.1081,CONSTRUCCION DE REDES URBANAS DE  AGUA POTABLE,ocds-5wno2w-MCO-EPEMAPAA-002-22-545597
1.0,119999.67,"SERVICIOS GENERALES DE CONSTRUCCION (INCLUIDAS LAS OBRAS NUEVAS, AMPLIACIONES, REFORMAS Y RENOVACION) EN ALMACENES Y EDIFICIOS INDUSTRIALES, TALES COMO LOS DE LA INDUSTRIA MANUFACTURA Y LIGERA",ocds-5wno2w-MCO-GADMLA-007-2022-91040
1.0,95128.691,OTRAS OBRAS DE INGENIERIA CIVIL,ocds-5wno2w-MCO-GADPRB_01-2022-121193
1.0,78559.64,HORMIGON PREMEZCLADO,ocds-5wno2w-MCO-GADPRPP-002-2022-126161
1.0,15200.0,"SERVICIOS DE MANTENIMIENTO Y REPARACION DE VEHICULOS DE MOTOR. ESTOS SERVICIOS PUEDEN INCLUIR LA REVISION DEL MOTOR, LA PUESTA A PUNTO DEL MOTOR, EL AJUSTE Y LA REPARACION DEL CARBURADOR, EL AJUSTE Y LA REPARACION DE LOS ELEMENTOS DE LA DIRECCION, LA REPA",ocds-5wno2w-MCS-5BI-2022-001-69973
1.0,50220.0,SERVICIOS RELACIONADOS CON  LA DISTRIBUCION DE ELECTRICIDAD ( A COMISION O POR CONTRATO),ocds-5wno2w-MCS-EERCS-002-2022-56835
1.0,7990.0,"SERVICIOS DE TRANSPORTE AEREO  DE PASAJEROS POR LINEAS AEREAS DE SERVICIO  EN HORARIOS REGULAR, INCLUSO LOS HELICOPTEROS DE CUALQUIER TIPO",ocds-5wno2w-MCS-SETEGISP-001-22-129983
1.0,16071.43,GASOLINA,ocds-5wno2w-MCS-PVIAL-002-2022-591671
1.0,5960.0,MANTENIMIENTO DEL SISTEMA ELECTRONICO DE AVIONES,ocds-5wno2w-RE-ALA23-003-2022-119075
1.0,21918.5,MANTENIMIENTO DEL SISTEMA ELECTRONICO DE AVIONES,ocds-5wno2w-RE-ALA23-004-2022-119075
1.0,7950.0,CONTRATACIÓN DE ESPACIOS PUBLICITARIOS PARA LOS ANUNCIOS DE RADIO Y TELEVISIÓN DEL CLIENTE EN LAS EMISORAS Y CANALES ELEGIDOS O SUGERIDOS POR LA AGENCIA,ocds-5wno2w-RE-CEFAS-01-2022-163197
1.0,21000.0,SERVICIOS DE SUMINISTROS DE UNA CONEXION DIRECTA A INTERNET,ocds-5wno2w-RE-CEP-GPI-003-2022-12001
1.0,120554.82,"SERVICIOS DE PLANIFICACION, CREACION Y EJECUCION DE LA TOTALIDAD O DE PARTE DE LAS CAMPANAS DE PUBLICIDAD, INCLUIDA LA SELECCION DE LOS MEDIOS DE INFORMACION QUE SE VAN A UTILIZAR, EL DISENO DE ANUNCIOS, ILUSTRACIONES, CARTELES, ETC., CONFECCION DE GUIONE",ocds-5wno2w-RE-CSPS-CBDMQ-02-202-2525
1.0,1785.71,SERVICIOS DE DIFUSION DE MUESTRAS Y OTRO MATERIAL PUBLICITARIO,ocds-5wno2w-RE-EMMSZACH-03-2022-585675
1.0,17880.5,TERMINAL DE DIRECCION,ocds-5wno2w-RE-GADMSPP-008-2022-24505
1.0,19000.0,SERVICIOS DE PRODUCCION DE EVENTOS,ocds-5wno2w-RE-GADPRE-01-202-115590
1.0,6000.0,SERVICIOS DE PRODUCCION Y PRESENTACION PARA REPRESENTACIONES ARTISTICAS LUZ Y SONIDO,ocds-5wno2w-RE-GADPS-002-2022-111581
1.0,281788.14,SERVICIOS DE MANTENIMIENTO Y REPARACION DE VEHICULOS DE MOTOR. ESTOS SERVICIOS PUEDEN INCLUIR LA REVISION DEL MOTOR,ocds-5wno2w-RE-PU-CBDMQ-008-2022-2525
1.0,11724.57,SERVICIOS DE MANTENIMIENTO Y REPARACION DE ASCENSORES,ocds-5wno2w-RE-PU-CGFT-4-2022-2562
1.0,19234.74,"SERVICIOS PARA PERMITIR, OTORGAR O AUTORIZAR DE OTRA MANERA EL USO DE DERECHOS PARA UTILIZAR PROGRAMAS DE COMPUTACION, DESCRIPCION DE PROGRAMAS Y MATERIALES DE APOYO PARA SISTEMAS Y  APLICACIONES DE SOFTWARE",ocds-5wno2w-RE-PU-GADPP-6-2022-2426
1.0,29700.0,SERVICIOS DE MANTENIMIENTO Y REPARACION DE VEHICULOS DE MOTOR. ESTOS SERVICIOS PUEDEN INCLUIR LA REVISION DEL MOTOR,ocds-5wno2w-RMCBS-HGA-001-2022-2764
1.0,7789.0,SERVICIOS DE VENTA O ARRENDAMIENTO DE ESPACIO O TIEMPO PARA ANUNCIOS EN LOS PERIODICOS,ocds-5wno2w-R-RE-CSCD-GADMA-001--2161
1.0,,SERVICIO DE CONSTRUCCION Y MANTENIMIENTO DE EFICACIONES Y PREDIOS,ocds-5wno2w-SIE-01-DDM-2022-83636
1.0,,"Amoxicilina + Ácido clavulánico, Sólido oral (polvo), (250 mg + 62,5 mg)/5 mL, Caja x frasco para reconstituir a 100 mL (mínimo) con dosificador",ocds-5wno2w-SIE-19D01-03-2022-569186
1.0,,"SERVICIOS DE MANTENIMIENTO Y REPARACION DE VEHICULOS DE MOTOR. ESTOS SERVICIOS PUEDEN INCLUIR LA REVISION DEL MOTOR, LA PUESTA A PUNTO DEL MOTOR, EL AJUSTE Y LA REPARACION DEL CARBURADOR, EL AJUSTE Y LA REPARACION DE LOS ELEMENTOS DE LA DIRECCION, LA REPA",ocds-5wno2w-SIE-05AGROPZACHIN-22-324558
1.0,,CAMARA PARA TERMOGRAFIA DETECCION Y REGISTRO DE IMAGENES TERMICAS,ocds-5wno2w-SIE-CELEGU-089-2022-238940
1.0,,REPARACION Y MANTENIMIENTO DE AIRE ACONDICIONADO,ocds-5wno2w-SIE-CELL-016-2022-3283
7500.0,,INSUMOS DE USO GENERAL,ocds-5wno2w-SIE-CMFIEDM-011-2022-748941
500.0,,TERMINALES Y CONECTORES DE CABLES,ocds-5wno2w-SIE-CNELESM-003-2022-462114
46.0,,INSUMOS DE USO GENERAL,ocds-5wno2w-SIE-CNELSTE-010-2022-462114
4141.0,,"HIERRO SACARATADO, OXIDO DE 100 MG/5 ML",ocds-5wno2w-SIE-DD08D04S-23-2022-167462
1.0,,"MATERIALES DE PUBLICIDAD (ARTICULOS PUBLICITARIOS, SERIGRAFIA, TAMPOGRAFIA, SOUVENIRS, ENTRE OTROS)",ocds-5wno2w-SIE-DD13D02S-2022-15-18162
1.0,,CATETER URETERAL ,ocds-5wno2w-SIE-DD09D04-014-2022-161795
1.0,,SERVICIOS DE MANTENIMIENTO Y REPARACION DE EQUIPO DE MEDICINA,ocds-5wno2w-SIE-DD18D02-017-2022-2727
1.0,,INSUMOS DE USO GENERAL,ocds-5wno2w-SIE-DD22D02-023-2022-537258
1.0,,ESCOBA DE PLASTICO FIBRA SUAVE,ocds-5wno2w-SIE-DD24D02-008-2022-19749
1.0,,"SERVICIOS DE IMPRENTA DCTOS VARIOS (TITULOS DE CONDUCCIÓN, ADHESIVOS, STICKERS,FORMAS CONTINUAS)",ocds-5wno2w-SIE-EMOVIMEP-2-2022-702285
1.0,,ACCESORIOS Y REPUESTOS PARA BOMBAS DE SERVICIO PETROLERO,ocds-5wno2w-SIE-EPP-015-2022-253178
1.0,,ACIDOS GRASOS INDUSTRIALES EPOXIDIZADOS,ocds-5wno2w-SIE-ESANGU-2022-006-81606
1.0,,OTRAS PARTES Y PIEZAS DE AVIONES O HELICOPTEROS; DE AERONAVES Y EQUIPO CONEXO; NAVES ESPACIALES,ocds-5wno2w-SIE-ESANGU-2022-007-81606
1.0,,SOPORTE TECNICO INFORMATICO,ocds-5wno2w-SIE-ESANGU-2022-001-81606
1.0,,PUNTO DE SERVICIO INSTITUCIONAL  DE 12 HORAS - LUNES A DOMINGO NOCTURNO CON ARMA LETAL,ocds-5wno2w-SIE-FDNE-001-2022-216595
22220.0,,POLLO,ocds-5wno2w-SIE-GADIPCS-2022-001-54077
1.0,,SERVICIOS DE RECOGIDA DE DESECHOS NO PELIGROSOS,ocds-5wno2w-SIE-GADMCH-022-2022-43412
12.0,,ACEITE LUBRICANTE PARA MOTORES A DIESEL,ocds-5wno2w-SIE-GADMIPA-05-2022-30228
1.0,,"SERVICIOS AUXILIARES DE ESPECTACULOS N.C.P (ORGANIZACION DE EVENTO SOCIAL, CULTURAL, DESFILE, ETC,)",ocds-5wno2w-SIE-GADMSD-016-2022-19455
1.0,,"Paracetamol, Líquido parenteral, 10 mg/mL, Caja x vial(es) x 100 mL",ocds-5wno2w-SIE-HEEE-061-2022-YA-52558
1.0,," CONSTRUCCION, AMPLIACIONES, REFORMAS CENTROS MEDICOS",ocds-5wno2w-SIE-HGI-012-HGI-2022-3260
1.0,,FUNDAS,ocds-5wno2w-SIE-HHCC-019-2022-8380
1.0,,INSUMOS DE USO GENERAL,ocds-5wno2w-SIE-HOSNAG-037-2022-2706
36.0,,INSUMOS DE USO GENERAL QUIRURGICO,ocds-5wno2w-SIE-HOSNAG-032-2022-2706
1.0,,SERVICIOS DE MANTENIMIENTO Y REPARACION DE EQUIPO DE REFRIGERACION,ocds-5wno2w-SIE-IESSCED-006-2022-172045
1.0,,INSUMOS DE USO GENERAL,ocds-5wno2w-SIE-IESS-HB-033-2022-102124
1.0,,SISTEMA PARA ELECTROLITOS,ocds-5wno2w-SIE-IESS-HB-034-2022-102124
118890.0,,"Hierro, multivitaminas y minerales: Hierro - Zinc - Vitamina A - Ácido fólico - Ácido ascórbico, Sólido oral (polvo), * 12,5 mg * 5 mg * 300 mcg * 160 mcg * 30 mg, Caja x sobres/sachets",ocds-5wno2w-SIE-RE-06D02-12-2022-575768
200.0,,"Calcio gluconato, Líquido parenteral, 10 %, Caja x ampolla(s) x 10 mL",ocds-5wno2w-SIE-RE-09D19-01-2022-18608
240.0,,VORICONAZOL SOLIDO PARENTERAL 200 MG,ocds-5wno2w-SIE-RE-HIAL-065-2022-8458
1.0,,SERVICIO DE ALQUILER DE FOTOCOPIADORAS,ocds-5wno2w-SIE-SZA-003-2022-50866
12.0,,"SERVICIOS COMERCIALES AL POR MENOR DE  EQUIPO DE RADIO Y  TELEVISION,  INSTRUMENTOS MUSICALES Y DISCOS, PARTITURAS Y CINTAS GRABADAS EN TIENDAS ESPECIALIZADAS",ocds-5wno2w-SIE-UA-010-2022-596700
600000.0,,"Atenolol, Sólido oral, 50 mg, Caja x blíster/ristra",ocds-5wno2w-SII-MIMG-013-2022-44856
1.0,,"ABONOS ANIMALES O VEGETALES, ESTEN O NO MEZCLADOS O QUIMICAMENTE TRATADOS; ABONOS PRODUCIDOS POR MEZCLA O TRATAMIENTO QUIMICO DE PRODUCTOS DE ORIGEN ANIMAL O VEGETAL: BONIGAS, COMPOSTE, DESPERDICIOS DE LANA, DE PELO DE ANIMALES, DE BELLONES SUCIOS,GUANO, ",ocds-5wno2w-SIE-UEMPRENDE-1-2022-448354
10.0,4.2448,CERA LIQUIDA PARA PISOS ANTIDESLIZANTE GALON,ocds-5wno2w-CE-20220002231692-93521
6.0,1.027824,GOMA EN BARRA DE 40 GR,ocds-5wno2w-CE-20220002232094-20836
12.0,0.4928,MARCADOR PERMANENTE NEGRO PUNTA REDONDA,ocds-5wno2w-CE-20220002232095-20836
13.0,0.728,MASKING DE 1 PULG. X 40 YARDAS MULTIUSO,ocds-5wno2w-CE-20220002231980-466685
26.0,0.4984,MARCADOR PERMANENTE NEGRO PUNTA REDONDA,ocds-5wno2w-CE-20220002231981-466685
6.0,1.4,TABLA PARA APUNTES (APOYAMANOS) PLASTICO,ocds-5wno2w-CE-20220002232105-20836
26.0,0.5264,RESALTADORES VARIOS COLORES,ocds-5wno2w-CE-20220002231979-466685
100.0,13.944,SERVICIOS DE CONFECCION DE PRENDAS DE VESTIR,ocds-5wno2w-CE-20220002231631-3219
100.0,1.12,SERVICIOS DE CONFECCION DE PRENDAS DE VESTIR,ocds-5wno2w-CE-20220002231631-3219
20.0,3.08,DESINFECTANTE AMONIO CUATERNARIO GALON,ocds-5wno2w-CE-20220002231680-93521
8.0,170.3296,NEUMATICO 255/70R16 111S TODA POSICION APLICACION TODO TERRENO,ocds-5wno2w-CE-20220002232203-101178
24.0,1.6576,MASKING DE 2 PULG. X 40 YARDAS MULTIUSO,ocds-5wno2w-CE-20220002231764-20699
12.0,38.2592,SERVICIOS DE CONFECCION DE PRENDAS DE VESTIR,ocds-5wno2w-CE-20220002231761-20699
15.0,2.912,"HIPOCLORITO DE SODIO AL 10 POR CIENTO, GALON",ocds-5wno2w-CE-20220002231679-93521
3.0,14.0,DISPENSADOR DE PAPEL HIGIENICO PARA ROLLOS JUMBO,ocds-5wno2w-CE-20220002231678-93521
12.0,1.7472,LIQUIDO PARA LIMPIAR VIDRIO ATOMIZADOR 500 CC,ocds-5wno2w-CE-20220002231677-93521
23.0,64.7472,UNIFORME DE OFICINA,ocds-5wno2w-CE-20220002231714-3203
1554.0,0.9296,PAPEL TOALLA DE MANOS BLANCO EN Z 150 UNIDADES,ocds-5wno2w-CE-20220002231757-840618
42.0,1.8592,LAPIZ HB CON GOMA CAJA 12 UNIDADES,ocds-5wno2w-CE-20220002231763-20699
26.0,1.848,LAPIZ HB CON GOMA CAJA 12 UNIDADES,ocds-5wno2w-CE-20220002231978-466685
6.0,0.155456,REGLA PLASTICA 30 CM,ocds-5wno2w-CE-20220002232096-20836
8.0,2.2064,TRAPEADOR REDONDO DE 24-30 CM,ocds-5wno2w-CE-20220002231812-84866
1427915.0,0.008064,"SERVICIOS QUE CONSISTEN EN LA LIMPIEZA Y MANTENIMIENTO DE VIVIENDAS O DE EDIFICIOS COMERCIALES, ADMINISTRATIVOS E INDUSTRIALE, LIMPIEZA Y ENCERADO DE PISOS",ocds-5wno2w-CE-20220002231918-2449
646.0,17.9424,SERVICIOS DE CONFECCION DE PRENDAS DE VESTIR,ocds-5wno2w-CE-20220002232026-258814
646.0,1.12,SERVICIOS DE CONFECCION DE PRENDAS DE VESTIR,ocds-5wno2w-CE-20220002232026-258814
24.0,2.352,PAPEL HIGIENICO JUMBO DOBLE HOJA BLANCO 250 METROS,ocds-5wno2w-CE-20220002231813-84866
646.0,13.944,SERVICIOS DE CONFECCION DE PRENDAS DE VESTIR,ocds-5wno2w-CE-20220002232025-258814
646.0,1.12,SERVICIOS DE CONFECCION DE PRENDAS DE VESTIR,ocds-5wno2w-CE-20220002232025-258814
29250.0,1.6576,"SERVICIOS DE LIMPIEZA Y MANTENIMIENTO DE VIVIENDAS O DE EDIFICIOS COMERCIALES, ADMINISTRATIVOS E INDUSTRIALE, LIMPIEZA Y ENCERADO DE PISOS",ocds-5wno2w-CE-20220002231893-1015227
52.0,5.6,SERVICIOS DE CONFECCION DE UNIFORMES,ocds-5wno2w-CE-20220002231870-541561
36.0,15.904,"SET DE MOPA (MANGO, BASE, MOPA) DE 46 CM",ocds-5wno2w-CE-20220002231646-2419
26.0,0.5376,MARCADOR TIZA LIQUIDA PUNTA  GRUESA VARIOS COLORES,ocds-5wno2w-CE-20220002231975-466685
13.0,0.155456,REGLA PLASTICA 30 CM,ocds-5wno2w-CE-20220002231976-466685
60.0,2.4024,PAÑO DE LIMPIEZA PARA SUPERFICIES 10 UNIDADES,ocds-5wno2w-CE-20220002231645-2419
26.0,0.933296,TINTA CORRECTORA TIPO ESFERO,ocds-5wno2w-CE-20220002231977-466685
2520.0,2.76304,PAPEL HIGIENICO JUMBO HOJA SIMPLE BLANCO 400 METROS,ocds-5wno2w-CE-20220002231644-2419
4.0,8.008,SERVICIOS DE CONFECCION DE PRENDAS DE VESTIR,ocds-5wno2w-CE-20220002231887-2805
4.0,1.12,SERVICIOS DE CONFECCION DE PRENDAS DE VESTIR,ocds-5wno2w-CE-20220002231887-2805
1100.0,0.295,Butilescopolamina (N-butilbromuro de hioscina),ocds-5wno2w-CE-20220002231919-93666
646.0,16.7888,SERVICIO DE CONFECCION DE ROPA DE TRABAJO,ocds-5wno2w-CE-20220002232027-258814
200.0,1.792,LAPICES DE COLOR CAJA 12 UNIDADES,ocds-5wno2w-CE-20220002231917-480287
71.0,1068.76,COMPUTADOR ESCRITORIO SOFTWARE PRIVADO 11,ocds-5wno2w-CE-20220002231770-818006
180.0,0.09968,SOBRE MANILA F5,ocds-5wno2w-CE-20220002232135-20799
82092.0,1.4448,"SERVICIOS DE LIMPIEZA Y MANTENIMIENTO DE VIVIENDAS O DE EDIFICIOS COMERCIALES, ADMINISTRATIVOS E INDUSTRIALE, LIMPIEZA Y ENCERADO DE PISOS",ocds-5wno2w-CE-20220002231632-35516
34.0,50.9488,ZAPATO DE CUERO TIPO BOTIN DE TRABAJO DE CAMPO PARA HOMBRE O MUJER,ocds-5wno2w-CE-20220002232204-3205
18.0,1.3888,TABLA PARA APUNTES (APOYAMANOS) PLASTICO,ocds-5wno2w-CE-20220002232133-20799
12.0,3.9872,DESTAPADOR DE CAÑERIAS GALON,ocds-5wno2w-CE-20220002232079-23759
12.0,4.0992,SERVICIOS DE CONFECCION DE PRENDAS DE VESTIR,ocds-5wno2w-CE-20220002232188-20836
26.0,0.2744,CLIPS STANDAR 25 MM METALICOS,ocds-5wno2w-CE-20220002231974-466685
4000.0,1.4448,"SERVICIOS DE LIMPIEZA Y MANTENIMIENTO DE VIVIENDAS O DE EDIFICIOS COMERCIALES, ADMINISTRATIVOS E INDUSTRIALE, LIMPIEZA Y ENCERADO DE PISOS",ocds-5wno2w-CE-20220002232190-20852
54.0,12.9808,SERVICIOS DE CONFECCION DE UNIFORMES,ocds-5wno2w-CE-20220002231871-541561
106.0,17.5952,SERVICIOS DE CONFECCION DE UNIFORMES,ocds-5wno2w-CE-20220002231871-541561
26.0,0.4984,MARCADOR PERMANENTE ROJO PUNTA REDONDA,ocds-5wno2w-CE-20220002231982-466685
506.0,1.12,SERVICIOS DE CONFECCION DE PRENDAS DE VESTIR,ocds-5wno2w-CE-20220002231697-102227
60.0,0.26768,ESPONJA PARA LAVAR PLATOS FIBRA MIXTA,ocds-5wno2w-CE-20220002231637-2419
60.0,1.2768,GUANTES DE CAUCHO NO 8 BICOLOR,ocds-5wno2w-CE-20220002231636-2419
10.0,2.4528,PAÑO DE LIMPIEZA PARA SUPERFICIES 10 UNIDADES,ocds-5wno2w-CE-20220002231689-93521
26.0,0.6048,SEPARADORES PLASTICOS A4 FUNDA 10 U,ocds-5wno2w-CE-20220002231986-466685
12.0,2.3184,JABON DE TOCADOR LIQUIDO CON VALVULA 500 ML,ocds-5wno2w-CE-20220002231681-93521
100.0,1.652,ARCHIVADORES TAMANO OFICIO LOMO 8 CMS,ocds-5wno2w-CE-20220002232034-54383
137.0,1.6576,ARCHIVADORES TAMANO OFICIO LOMO 8 CMS,ocds-5wno2w-CE-20220002231985-466685
12.0,199.5392,MUEBLES DE ESCUELA,ocds-5wno2w-CE-20220002231713-365398
5.0,289.8784,MUEBLES DE ESCUELA,ocds-5wno2w-CE-20220002231713-365398
8.0,153.2944,MUEBLES DE ESCUELA,ocds-5wno2w-CE-20220002231713-365398
26.0,0.448,MARCADOR PERMANENTE AZUL PUNTA REDONDA,ocds-5wno2w-CE-20220002231984-466685
36.0,1.0192,ATOMIZADOR 500 CC,ocds-5wno2w-CE-20220002231634-2419
500.0,0.6944,BLOCK EJECUTIVO 50 HOJAS,ocds-5wno2w-CE-20220002231765-20699
20.0,8.85,SERVICIOS DE CONFECCION DE PRENDAS DE VESTIR,ocds-5wno2w-CE-20220002231762-20699
60.0,1.5344,TRAPEADOR REDONDO DE 24-30 CM,ocds-5wno2w-CE-20220002231642-2419
60.0,1.9544,ESCOBA DE MADERA FIBRA DE COCO DE 30 CM,ocds-5wno2w-CE-20220002231643-2419
47.0,1.848,LAPIZ HB CON GOMA CAJA 12 UNIDADES,ocds-5wno2w-CE-20220002232228-1082335
52.0,1.6128,CRAYONES ESCOLARES JUMBO GIGANTE 12 COLORES,ocds-5wno2w-CE-20220002231987-466685
6.0,3.0688,SHAMPOO PARA AUTOS GALON,ocds-5wno2w-CE-20220002232069-309775
72.0,1.68,AMBIENTAL VARIAS FRAGANCIAS EN AEROSOL 360 CC,ocds-5wno2w-CE-20220002231638-2419
6.0,20.1824,SERVICIOS DE CONFECCION DE PRENDAS DE VESTIR,ocds-5wno2w-CE-20220002232187-20836
6.0,31.7072,SERVICIOS DE CONFECCION DE PRENDAS DE VESTIR,ocds-5wno2w-CE-20220002232186-20836
50.0,3.3488,PAPEL TOALLA DE MANOS BLANCO ROLLO 100 METROS,ocds-5wno2w-CE-20220002232074-309775
50.0,0.4928,MARCADOR PERMANENTE NEGRO PUNTA REDONDA,ocds-5wno2w-CE-20220002231925-39594
12.0,2.4528,PAÑO DE LIMPIEZA PARA SUPERFICIES 10 UNIDADES,ocds-5wno2w-CE-20220002232073-309775
60.0,0.4816,CINTA DE EMBALAJE TRANSPARENTE 2 PULGADAS X 40 MTS,ocds-5wno2w-CE-20220002231924-39594
50.0,0.8904,PARES DE PILAS AAA (ALCALINA),ocds-5wno2w-CE-20220002231923-39594
84.0,2.464,"HIPOCLORITO DE SODIO AL 5 POR CIENTO, GALON",ocds-5wno2w-CE-20220002231639-2419
50.0,0.4592,MARCADOR PERMANENTE AZUL PUNTA REDONDA,ocds-5wno2w-CE-20220002231921-39594
4.0,5.5888,REPUESTO DE TRAPEO (MOPA) DE 46 CM,ocds-5wno2w-CE-20220002232072-309775
50.0,2.352,PAPEL HIGIENICO JUMBO DOBLE HOJA BLANCO 250 METROS,ocds-5wno2w-CE-20220002232071-309775
100.0,0.5376,MARCADOR TIZA LIQUIDA PUNTA  GRUESA VARIOS COLORES,ocds-5wno2w-CE-20220002231903-480287
24.0,0.896,CEPILLO PARA SANITARIO SIN BASE PLASTICA,ocds-5wno2w-CE-20220002231635-2419
24.0,2.3296,JABON DE TOCADOR LIQUIDO CON VALVULA 500 ML,ocds-5wno2w-CE-20220002232070-309775
100.0,0.5152,CARPETAS PLASTICAS UN LADO TRANSPARENTE,ocds-5wno2w-CE-20220002231913-480287
132006.0,1.4448,"SERVICIOS DE LIMPIEZA Y MANTENIMIENTO DE VIVIENDAS O DE EDIFICIOS COMERCIALES, ADMINISTRATIVOS E INDUSTRIALE, LIMPIEZA Y ENCERADO DE PISOS",ocds-5wno2w-CE-20220002232206-123069
12.0,154.4032,MUEBLES DE ESCUELA,ocds-5wno2w-CE-20220002231712-365398
12.0,1.2768,GUANTES DE CAUCHO NO 9 BICOLOR,ocds-5wno2w-CE-20220002232086-23759
1.0,134.1424,NEUMATICO 235/60R16 100T 4X4C TODA POSICION APLICACION REGIONAL,ocds-5wno2w-CE-20220002232136-533059
2.0,171.584,NEUMATICO 255/70R16 111S TODA POSICION APLICACION TODO TERRENO 60/40,ocds-5wno2w-CE-20220002231845-553007
2.0,50.9488,ZAPATO DE CUERO TIPO BOTIN DE TRABAJO DE CAMPO PARA HOMBRE O MUJER,ocds-5wno2w-CE-20220002231771-96227
73.0,43.96,ZAPATO DE CUERO CON CORDONES PARA HOMBRE,ocds-5wno2w-CE-20220002232205-3205
22.0,55.9888,BOTA EN CUERO,ocds-5wno2w-CE-20220002232205-3205
2.0,141.792,NEUMATICO 225/70R16 103T TODA POSICION APLICACION TODO TERRENO,ocds-5wno2w-CE-20220002231844-553007
118.0,0.2856,CINTA ADHESIVA 18 X 50 YDAS,ocds-5wno2w-CE-20220002232029-54383
200.0,0.682528,GRAPAS 26/6 CAJA DE 5000 U,ocds-5wno2w-CE-20220002232028-54383
10.0,1.3216,GUANTES DE CAUCHO NO 7 Y MEDIO BICOLOR,ocds-5wno2w-CE-20220002231814-84866
